{
  "manifestVersion": "1.0.0",
  "generatedAt": "2026-09-25T13:13:00Z",
  "canonicalizationAlgorithm": "DETERMINISTIC_SORTED_JSON_V1",
  "manifestIntegrityHash": "sha256:9e49e46c1d27783d58b12d8998f269cb7bda86ee96f6f56b47815646a2da20d0",
  "hostEnvironment": {
    "os": "Windows",
    "osBuild": "Windows-11-10.0.26220-SP0",
    "pythonVersion": "3.13.9",
    "uvVersion": "0.11.26",
    "processorArchitecture": "AMD64"
  },
  "summary": {
    "totalScenarios": 47,
    "passed": 43,
    "failed": 0,
    "blocked": 3,
    "notRun": 1
  },
  "scenarios": [
    {
      "scenarioId": "RH01",
      "requirement": "Live socket connection establishment and transport framing",
      "result": "PASS",
      "qualificationLevel": "SIMULATED",
      "testIdentifier": "packages/client_runtime/tests/test_track35_real_host.py::test_rh01_rh02_live_connection_and_handshake",
      "executionTimestamp": "2026-09-25T13:13:00Z",
      "assertionsExecuted": [
        "client.lifecycle.current_state == ConnectionState.CONNECTED",
        "transport.is_connected is True"
      ],
      "evidenceArtifacts": [
        {
          "relativePath": "packages/client_runtime/tests/test_track35_real_host.py",
          "sha256": "4b5dc00b73c4ec5f30ec60cfb92d6e32f58e45e9985a7bb0daee7d7c66dc826e"
        }
      ],
      "limitations": "Executed against in-memory LoopbackTransport; external TCP socket open unverified."
    },
    {
      "scenarioId": "RH02",
      "requirement": "Gateway handshake version negotiation and session receipt",
      "result": "PASS",
      "qualificationLevel": "SIMULATED",
      "testIdentifier": "packages/client_runtime/tests/test_track35_real_host.py::test_rh01_rh02_live_connection_and_handshake",
      "executionTimestamp": "2026-09-25T13:13:00Z",
      "assertionsExecuted": [
        "client.session is not None",
        "client.session.session_id == 'sess_rh_test'",
        "client.session.server_version == '3.4'"
      ],
      "evidenceArtifacts": [
        {
          "relativePath": "packages/client_runtime/tests/test_track35_real_host.py",
          "sha256": "4b5dc00b73c4ec5f30ec60cfb92d6e32f58e45e9985a7bb0daee7d7c66dc826e"
        }
      ],
      "limitations": "Gateway handshake response was mocked by local receiver."
    },
    {
      "scenarioId": "RH03",
      "requirement": "Ingress chat turn creation and response routing",
      "result": "PASS",
      "qualificationLevel": "SIMULATED",
      "testIdentifier": "packages/client_runtime/tests/test_track35_real_host.py::test_rh03_rh04_chat_and_event_streaming",
      "executionTimestamp": "2026-09-25T13:13:00Z",
      "assertionsExecuted": [
        "acceptance.accepted is True",
        "acceptance.turn_id == 'turn_rh_1'"
      ],
      "evidenceArtifacts": [
        {
          "relativePath": "packages/client_runtime/tests/test_track35_real_host.py",
          "sha256": "4b5dc00b73c4ec5f30ec60cfb92d6e32f58e45e9985a7bb0daee7d7c66dc826e"
        }
      ],
      "limitations": "Chat turn acceptance generated by mock gateway receiver."
    },
    {
      "scenarioId": "RH04",
      "requirement": "Authoritative streaming event delivery and view reducer update",
      "result": "PASS",
      "qualificationLevel": "SIMULATED",
      "testIdentifier": "packages/client_runtime/tests/test_track35_real_host.py::test_rh03_rh04_chat_and_event_streaming",
      "executionTimestamp": "2026-09-25T13:13:00Z",
      "assertionsExecuted": [
        "task_view.status == 'RUNNING'",
        "'node_exec' in task_view.nodes",
        "task_view.nodes['node_exec'].status == 'RUNNING'"
      ],
      "evidenceArtifacts": [
        {
          "relativePath": "packages/client_runtime/tests/test_track35_real_host.py",
          "sha256": "4b5dc00b73c4ec5f30ec60cfb92d6e32f58e45e9985a7bb0daee7d7c66dc826e"
        }
      ],
      "limitations": "Single-process in-memory frame delivery."
    },
    {
      "scenarioId": "RH05",
      "requirement": "Category B telemetry streaming with high-watermark dropping",
      "result": "PASS",
      "qualificationLevel": "SIMULATED",
      "testIdentifier": "packages/client_runtime/tests/test_track35_real_host.py::test_rh05_rh06_telemetry_streaming_and_secret_scrubbing",
      "executionTimestamp": "2026-09-25T13:13:00Z",
      "assertionsExecuted": [
        "len(task_view.stdout_chunks) == 2",
        "'Chunk 1' in task_view.stdout_chunks[0]"
      ],
      "evidenceArtifacts": [
        {
          "relativePath": "packages/client_runtime/tests/test_track35_real_host.py",
          "sha256": "4b5dc00b73c4ec5f30ec60cfb92d6e32f58e45e9985a7bb0daee7d7c66dc826e"
        }
      ],
      "limitations": "Backpressure drop simulated in local harness."
    },
    {
      "scenarioId": "RH06",
      "requirement": "Real-host telemetry secret scrubbing and redaction preservation",
      "result": "PASS",
      "qualificationLevel": "SIMULATED",
      "testIdentifier": "packages/client_runtime/tests/test_track35_real_host.py::test_rh05_rh06_telemetry_streaming_and_secret_scrubbing",
      "executionTimestamp": "2026-09-25T13:13:00Z",
      "assertionsExecuted": [
        "'sk-live-secret-test-key' not in combined_output",
        "'[REDACTED]' in combined_output"
      ],
      "evidenceArtifacts": [
        {
          "relativePath": "packages/client_runtime/tests/test_track35_real_host.py",
          "sha256": "4b5dc00b73c4ec5f30ec60cfb92d6e32f58e45e9985a7bb0daee7d7c66dc826e"
        }
      ],
      "limitations": "Validates that redacted tokens received from gateway are rendered cleanly without unmasking."
    },
    {
      "scenarioId": "RH07",
      "requirement": "Heartbeat ping-pong round-trip and RTT latency tracking",
      "result": "PASS",
      "qualificationLevel": "LOCAL",
      "testIdentifier": "packages/client_runtime/tests/test_track35_real_host.py::test_rh07_rtt_latency_measurement",
      "executionTimestamp": "2026-09-25T13:13:00Z",
      "assertionsExecuted": [
        "hb.latency_ms >= 0.0",
        "hb.missed_pings == 0"
      ],
      "evidenceArtifacts": [
        {
          "relativePath": "packages/client_runtime/tests/test_track35_real_host.py",
          "sha256": "4b5dc00b73c4ec5f30ec60cfb92d6e32f58e45e9985a7bb0daee7d7c66dc826e"
        }
      ],
      "limitations": "Evaluated using Windows high-resolution performance counter; zero actual network latency."
    },
    {
      "scenarioId": "RH08",
      "requirement": "Abrupt transport drop detection and view freshness transition",
      "result": "PASS",
      "qualificationLevel": "SIMULATED",
      "testIdentifier": "packages/client_runtime/tests/test_track35_real_host.py::test_rh08_rh09_socket_drop_and_cursor_reconnect",
      "executionTimestamp": "2026-09-25T13:13:00Z",
      "assertionsExecuted": [
        "client.lifecycle.current_state == ConnectionState.DISCONNECTED",
        "client.view_state.freshness == ViewFreshness.RECONNECTING"
      ],
      "evidenceArtifacts": [
        {
          "relativePath": "packages/client_runtime/tests/test_track35_real_host.py",
          "sha256": "4b5dc00b73c4ec5f30ec60cfb92d6e32f58e45e9985a7bb0daee7d7c66dc826e"
        }
      ],
      "limitations": "Transport drop triggered by synthetic event; not an OS network interface flap."
    },
    {
      "scenarioId": "RH09",
      "requirement": "Reconnection with ResumeCursor catch-up replay resumption",
      "result": "PASS",
      "qualificationLevel": "SIMULATED",
      "testIdentifier": "packages/client_runtime/tests/test_track35_real_host.py::test_rh08_rh09_socket_drop_and_cursor_reconnect",
      "executionTimestamp": "2026-09-25T13:13:00Z",
      "assertionsExecuted": [
        "cur.global_seq == 250",
        "client.lifecycle.current_state == ConnectionState.CONNECTED",
        "client.view_state.freshness == ViewFreshness.LIVE"
      ],
      "evidenceArtifacts": [
        {
          "relativePath": "packages/client_runtime/tests/test_track35_real_host.py",
          "sha256": "4b5dc00b73c4ec5f30ec60cfb92d6e32f58e45e9985a7bb0daee7d7c66dc826e"
        }
      ],
      "limitations": "Catchup response synthesized by mock receiver from globalSeq 250."
    },
    {
      "scenarioId": "RH10",
      "requirement": "Multi-tab session continuation across page reload",
      "result": "PASS",
      "qualificationLevel": "SIMULATED",
      "testIdentifier": "packages/client_runtime/tests/test_track35_real_host.py::test_rh10_multi_tab_continuation_across_reload",
      "executionTimestamp": "2026-09-25T13:13:00Z",
      "assertionsExecuted": [
        "tab2_state['activeTaskId'] == 'task_reload'",
        "tab2_state['tabId'] == 'tab_restored'"
      ],
      "evidenceArtifacts": [
        {
          "relativePath": "packages/client_runtime/tests/test_track35_real_host.py",
          "sha256": "4b5dc00b73c4ec5f30ec60cfb92d6e32f58e45e9985a7bb0daee7d7c66dc826e"
        }
      ],
      "limitations": "In-memory tab context; physical Chromium browser processes not attached."
    },
    {
      "scenarioId": "RH11",
      "requirement": "Asynchronous turn cancellation acceptance and event routing",
      "result": "PASS",
      "qualificationLevel": "SIMULATED",
      "testIdentifier": "packages/client_runtime/tests/test_track35_real_host.py::test_rh11_rh12_cancellation_and_approval",
      "executionTimestamp": "2026-09-25T13:13:00Z",
      "assertionsExecuted": [
        "cancellation.accepted is True",
        "cancellation.cancellation_request_id == 'c_rh_100'"
      ],
      "evidenceArtifacts": [
        {
          "relativePath": "packages/client_runtime/tests/test_track35_real_host.py",
          "sha256": "4b5dc00b73c4ec5f30ec60cfb92d6e32f58e45e9985a7bb0daee7d7c66dc826e"
        }
      ],
      "limitations": "Cancellation acceptance verified via mock receiver."
    },
    {
      "scenarioId": "RH12",
      "requirement": "Interactive CAS approval resolution with revision verification",
      "result": "PASS",